用户,是否看过,评分,评论时间,有用数,评论,
Crystalline,看过,力荐,2017/3/28 0:40,21371,跟媳妇一起看的。看到一半的时候说了句最毒妇人心，指的那个情妇。后来看完，我媳妇特别藐视我，说了句男人都不是个好东西后睡了~。。我一脸尴尬~。。。总之。。。这是个好电影。,
﻿冰山李,看过,较差,2017/3/29 19:03,266,看不出导演做了什么，感觉还是好好干编剧吧,
Enigma,看过,力荐,2017/3/20 19:12,11775,其实这种多重反转的电影很容易bug频出，但是这部完成度太高了，质感和小细节都相当漂亮。导演对后半程的解密把控地相当出色，直接让观感上升了一个level。西班牙的悬疑片总是给人惊喜。（猜到反转并不是多了不起的事，请不要在悬疑片短评区剧透好吗，靴靴。）,
frozenmoon,看过,推荐,2017/3/28 19:37,12388,律师是假扮的这个梗其实倒是不难猜。不过这不是重点。重点在于“叙述”和“真相”的关系。在缺乏物证链条的基础上，男主的每一次叙述其实都是自洽且成立的，但或许也都不是真的。这一点才真的引人深思。我们所认定和掌握的真相，又有多少是被叙述掌控的呢？,
大島,看过,推荐,2017/9/4 22:23,6836,西班牙人太热情了 在我们这房间里叫破喉咙都没人理的,
Fornever,看过,推荐,2017/4/2 16:44,4125,好看。另外建议豆瓣给「我看了七分钟就猜到结局」的观众准备彩蛋，他们是推动电影业进步的动力，值得满屏掉落大拇指。,
颜落寒,看过,推荐,2017/3/19 7:35,3826,剧本太精彩，处处伏笔，层层反转，虚实交错，暗潮涌动。自作聪明的往往一败涂地，不动声色的才能笑到最后。,
芦哲峰,看过,推荐,2017/3/27 11:31,3323,所有爱玩反转的悬疑电影都可以用一句话来概括：你以为你以为的就是你以为的。,
柯里昂,看过,推荐,2017/3/21 13:10,1358,看过片子后再来这个页面，发现海报上人物关系已经把结局剧透了。观影过程很享受，虽然结局并不难猜，但几段假设推理确实容易被误导，尽管每个假设都有一些经不起推敲的小细节，但是并不影响整体效果，除了老夫妻过分精明和易容的不彻底外，几乎没有大败笔。说别人脸盲的希望你在电影院也能一眼认出来。,
VeryGZ,看过,还行,2017/3/22 21:56,7207,开。车。的。时。候。不。要。谈。情。说。爱！ 系。好。安。全。带！（认真脸）,
影志,看过,力荐,2017/3/25 23:15,7230,现在能有意外结局还让人颠覆的故事，真的很难得了。结局半小时的反转再反转，能自圆其说，能刷新认识，能大呼过瘾，对一部悬疑推理片来说已经完成的相当漂亮。不会苛求太多，这样的故事和设定已经满足。,
麻绳,看过,推荐,2017/3/25 20:32,1133,作为一部连环反转的惊悚片，此片对观众心理的拿捏是教科书级别的。不难猜中结局，但这个过程还是太精彩了。,
王大根,看过,推荐,2017/9/16 14:45,285,日本小说里一百个这样的故事有没有，可能还不止一百个,
子酉,看过,还行,2017/3/26 13:44,1961,一部片检验脸盲症发病率。,
孬爷爷و,看过,力荐,2017/4/2 21:35,672,记得拉窗帘！,
朝暮雪,看过,推荐,2017/3/27 11:46,297,竟然能把“打小三”的故事拍到《控方证人》和《罗生门》的高度，服气！,
黄青蕉,看过,推荐,2017/4/25 20:53,274,叙事的细腻和节奏感还是挺好的，就是最后那个易容梗太没必要了，完全有别的办法可以规避漏洞，况且易完之后还是很像好吗！只够欺负重度脸盲了！,
Andrea,看过,力荐,2017/3/24 23:00,6020,好看，强烈推荐。问题是如此重要的辩护人竟然不是当面引荐的。,
Indecent time,看过,力荐,2017/4/25 23:43,3417,“男主玩家的言论真是无懈可击，可惜我是预言家，你已经被我查杀了，你自爆不自爆”,
同志亦凡人中文站,看过,推荐,2017/3/28 19:42,573,拍摄手法太像在套供了，导致看到一半就猜到了故事走向。Mario Casas留胡子后还是那么sexy～,
Panda的影音,看过,力荐,2017/3/24 23:32,1486,2015年看的《罪恶之家》，2016年看的《完美陌生人》，2017年看的《看不见的客人》，共通之处就是利用剧作上的巧合和人性的叵测，将一个充满黑色悬疑的精彩故事有条不紊地讲述出来，虽然过程中猜测出女律师古德曼的身份，但劳拉却并非我预测地来个《大卫·戈尔的一生》的自我救赎……人言可畏亦难信？！,
文泽尔,看过,力荐,2017/3/29 17:54,953,调度上有种将阿加莎小说当代化的直感 谷仓之冰和密室的三重解答亦是对黄金时代的致敬 拍推理片需要的是娓娓道来 不急不缓的叙述 以及临近收尾时暴风骤雨般地揭晓真相 本片都做到了 虽然对于非脸盲症而言这个最早来自莎士比亚的诡计略显累赘 讲义系列若拍成电影 要的也是这种感觉,
木卫二,看过,推荐,2017/9/19 22:51,492,就不断论证这么个事：人很坏，坏到你都无法想象的坏，尤其是那些高高在上的社会精英。只有如此诛心，才能理解男主为何要铤而走险。最后结局自然要掉入一个常见套路：反派死于话多。作为电影，除制造冷色与调成昏暗，仍有种故意制造紧张悬念惊悚的搬演感觉。还有，终于明白那么多人看目击者要想到它,
喜悦之地,看过,力荐,2017/3/22 13:59,823,2016最佳，好久没看这种过山车式悬疑片了,
有心打扰,看过,还行,2017/3/20 20:57,1294,有多少人是猜中了结尾却没猜中过程？有多少人是对猜中的结尾感到失望，对没猜中的过程感到傻逼？影片的引申主题就是——只要是个人说的话都别信。,
亚比煞,看过,力荐,2017/7/12 23:06,569,精彩的本子。最后的反转倒不难，难在多重结构的编织，对话环环相扣，很不好写，特别容易出bug，这个编剧完成的很漂亮。,
杨迪,看过,力荐,2017/5/22 1:29,624,整个看到鸡皮疙瘩大起，爱死了。,
CyberKnight电子骑士,看过,还行,2017/4/25 22:52,1006,8.7分真过誉了，IMDb7.9都偏高。与《谜一样的双眼》《消失的爱人》《一级恐惧》《非常嫌疑犯》等同类比都有所不如，刻意于情节的twist，对主题和角色都缺乏发掘展开（女主小三都没给出确定性格，完全功能角色）。看后缺乏回味，生硬和缺乏逻辑的地方很多。咱这儿还真喜欢这种看似烧脑、高智商的片子。,
姐姐起飞,看过,推荐,2017/3/25 22:06,336,"是我喜欢的片子类型。""生意上如此成功的人，怎么可能这么没有决断力呢。"" 所以从逻辑上，就推翻他的谎言了。",
LeungChanXXX,看过,推荐,2017/3/19 10:35,314,剧本算不上特别高明缜密，但不妨碍故事讲得足够精彩，以及叙事上用了类似罗生门式结构，只是电影依旧有着那种套路式的、早已透露导演心思算盘的“工整”，即便诡计再多反转也不难猜，揭底时也没有太多意外感，不过近几年西班牙悬疑惊悚片确实是后起之秀。相比导演前作《女尸谜案》还是有进步的。,
malingcat,看过,推荐,2017/10/10 18:42,137,观影时，一直在研究，到底是男的更聪明还是女的更聪明？几次反转之后，懂了，母亲更聪明。,
大奇特(Grinch),看过,推荐,2017/9/3 23:10,67,一问一答的形式攻防兼备，各种可能性令故事发展和内心交战巧妙地呈现，观众可以从各个角度辩证。第一起案件采用密室推理的技巧，也是转移注意力的方法，因为第二起案件与第一起之间的联系才是问题根本。导演沿袭了《女尸谜案》的套路，又加入了《骑车人之死》和《控方证人》的技巧。,
恶魔的步调,看过,还行,2017/3/26 21:49,136,有完成度，但缺乏惊喜，只是一般的两集长度犯罪类美剧的水准。其实这就是一部走进科学。,
科林,看过,推荐,2017/4/4 0:09,63,说实话，我真看一半猜到结尾了……因为没有脸盲症，始终觉得某某和某某长得很像……（好像不对……这不应该是有脸盲症的理由吗？……）,
种瓜得瓜,看过,还行,2017/4/7 21:52,151,即使编剧做了各种人设，老夫妻两个喜欢看戏剧表演，老妇以前教文学（编剧本没问题），也无法说服我扮演一个律师，毕竟她儿子最后是没死而被男主推入湖中并不在他们的剧本内，而本身并非律师应该是无法应付这种突发状况的。一开始就猜测律师是老头对方的，结局果然是，这就可以了，没必要一定要老妇去。,
城南草木生,看过,较差,2018/2/14 23:03,76,什么年代了 还易容术 还人皮面具 什么玩意 烧什么脑 烧里凉,
обломов,看过,还行,2017/3/23 21:07,4033,比较一般，如果男主是策划一切的人，他根本不会如此相信一个素未谋面的人,
张小北,看过,力荐,2017/9/17 13:40,201,4星半。 不过西班牙新导演值得鼓励一下。而且影院观影体验太好了。,
matchbox,看过,推荐,2017/3/23 23:56,255,应该把男主叙述中的开车人换成情人，会让这个版本情人选择毁尸灭迹的动机更合理。最后的隔窗对视过于dramatic。其实四眼阿婆演金牌律师怎么就滴水不漏这个事情本身好像是最大的bug。,
西楼尘,看过,还行,2017/5/17 0:28,315,看得见的客人堂而皇之走进来，逼出真相；看不见的客人无踪无影溜出去，疑窦丛生。人心有看得见的角落，装着你车坏了我替你修的善意；也有看不见的角落，盛着容不得你苟活的凶恶。商界杀伐决断化作情感中的冷血残暴，机关算尽却低估了丧子之痛。需要多大的定力，在得知儿子本应存活的时候，不喊一声痛。,
老袁,看过,推荐,2017/3/22 11:41,144,电影已经做得不错，很多遗憾是因为影像的直露造成的，如果这是一篇短篇小说，会更精彩。,
蔕,看过,力荐,2017/3/22 21:31,376,为了掩饰一个谎言需要更多谎言，践踏过一次人性，下次就更容易了。随着故事推进能猜到一些反转，但紧张的节奏和没有一点废话时间的剧情能吸引你不断看下去，反转套着下一个反转，当真相全部揭开的时候必须叫一声好。西班牙意大利一些小成本电影质量真高,
汪金卫,看过,较差,2017/9/5 15:30,121,大失所望。看到了《闪灵》《告白》等片的影子。刚开场就猜中真凶的感觉还真是不太好。反复地反转也是忽悠观众，结尾更是扯淡，说换脸就换，你是权游无面者啊？所谓伏笔细节等非常拙劣浅薄。剧情中角色的动机、逻辑等完全不着调地随便玩弄。别说烧脑，简直是故弄玄虚，幼稚可笑。再看一遍的话会给1星吧,
刘康康,看过,还行,2017/9/16 15:18,357,所以……都不用确认对方的身份，也不用自己的私人律师在场，就这样跟一个第一次见面的人和盘托出？当然，细节上的小设计还是很不错的，喜欢调整汽车座椅这个设计，很生活又很巧妙，打火机和汽车入水的蒙太奇也不错。,
匡轶歌,看过,还行,2017/3/28 19:52,86,sorry 从这部片子里木有get 到快感，看完琢磨了一会儿，还觉得bug挺硬的。世上最完美之事，大概就是从来都没有什么“完美谋杀”，自得于完美的人，最后总是被老天整得很惨。,
艾小柯,看过,还行,2017/5/5 9:03,74,剧本蛮不错，就是表演比较夸张，更具舞台剧的特色。,
Lycidas,看过,推荐,2017/3/23 21:59,70,@balmes 一边领着观众误入歧途和男主一起受困于那间“密室”，一边又通过律师之口一次次强调：集中注意力，别放过细节，换角度思考。这些字句既是挑战亦是劝导，猜出反转沾沾自喜的人也许不该忘了片中人自作聪明的下场。人心的纵横沟壑幽深难测，没有什么人真比旁人高明，唯有少走夜路才能不撞到鬼。,
九尾黑猫,看过,还行,2017/3/27 22:43,79,三星半。从一个有趣的角度去解开密室杀人案，里面又嵌套了另外一个案件，是个布局精巧的迷宫。讲述中的暗示和误导，也让旁观者有参与感。但每个犯罪故事，最终令人印象深刻的是这迷雾背后的人，他们的性格、身世和故事，是什么导致的悲剧，也是这些的欠缺让结局少了力度。,
Hoja,看过,还行,2020/8/12 13:20,90,最大的悬疑点在于，评分为什么这么高🤷‍♀️,
LORENZO 洛伦佐,看过,推荐,2017/4/9 6:05,45,叙事清晰，摄影干练，西班牙被拍得好美。表演也真诚，但是故事有点老派啊，开篇让人想到《套利交易》，一样的偷情车祸。可能悬疑片看的有点多，以为会被震撼到，可还是在最后半小时猜到了结局，没有炫耀的意思，其实我只是想说，编剧为了多几次反转制造的巧合有点多了，但仍不失为一个巧思的故事。,
国王KING,看过,力荐,2017/3/24 9:58,72,继《消失的爱人》后，我最喜欢的犯罪片。一次次的反转，到最后居然是被害者母亲与凶手的对峙……,
酒鬼一家小迷妹,看过,推荐,2018/1/12 12:58,232,看到最后真觉得男孩的父母很辛苦，很坚持也很厉害。,
cherrie,看过,推荐,2017/3/20 3:13,80,密室梗，老艺人们演技都不错。唯一的问题是，从一开始我就认出来了女律师…观影感受一落千丈。,
快乐人生,看过,推荐,2018/2/27 16:38,65,可以给它添上很多标签，电影开篇直入主题，从头到尾紧张悬疑，编剧思维缜密，滴水不漏，步步陷阱，以为猜到了结局，仅仅是个开始，大结局让你目瞪口呆，完全料想不到。,
岛上的夏奈,看过,力荐,2017/4/8 12:30,189,我没有猜到结局！,
狄飞惊,看过,推荐,2017/3/28 23:55,54,猜没猜到结局不重要，关键是过程确实很抓人。这个类型曾经是我迷影的动力，现在快看不动了，但这部值得推荐。,
欢乐分裂,看过,推荐,2017/3/23 20:55,67,3.5；小格局低成本的西班牙惊悚片较少令人失望，情节抓人，剧本流畅，套路&反套路，反转&逆反转，不同视角的叙述较全景模式的罗生门更复杂，加上转述、臆想、推测，案件现场的主观镜头之迷惑性，都构成重重迷雾，直指人性黑暗面；结尾两幢大楼间的遥望好评，《怪房客》附身。,
小岩井,看过,力荐,2017/7/25 17:22,159,了不起的剧本，看了两遍发现细节满满，不败退休律师的提前到来，打不通菲利克斯的电话，以及中间闲聊的时候提到妻子以前在剧团工作，以及情妇前后长短发的改变，包括最后那支笔的几次特写，这样的剧情电影真的是让人感到反转的快感。所以还是那个意见，编剧才是一部剧的核心。即使中间猜到了结局但无碍,
焚紙樓,看过,很差,2017/8/2 18:50,33,弱，或，弱智，給這片的評價只能如此二擇。打從律師脫口自稱30年不敗，這部片就自我宣告無藥可救了──卡通人物亂入寫實懸疑，誰拍成功過？,
米粒,看过,还行,2018/1/29 19:22,44,查查说的没错啊，这不就是个天涯连载帖水平的故事吗，而且还是比较土锤那种一看就是“分享你现编的故事”，不是很想追下去的那种。。。当飞机电影看算是合格吧,
寒狐传媒,看过,力荐,2017/4/19 1:10,82,4.5星。鹿在林中跑，锅从天上来。老娘不发威，你当我是爱心律师啊。,
牛三牛,看过,力荐,2017/3/23 20:36,76,完了，我把年度个人最佳悬疑片提前确定了。,
冰红深蓝,看过,推荐,2017/9/30 14:33,39,作为犯罪悬疑片来说足够精彩和抓人了，节奏快，层层叠叠的罗生门式叙事。不过，就我个人来说，影片结束没多久后，那种由不断反转带来的压迫感与激动就消散了。如果从后现代理论角度看，本片也印证了“一切都是文本”的（继而一切叙事都是可疑的）观点。再仔细想想，影片也解构掉了自身。（8.0/10）,
Rilkelee,看过,较差,2017/5/12 19:22,21,烧脑，高智商；人性，神反转；一部豆瓣高分片就这么出来了哦耶！,
端木夜,看过,推荐,2018/2/27 17:01,57,特别烧脑，高智商对决，到处是伏笔，一直在反转再反转，挺刺激的,
唐唐唐唐唐唐-。,看过,力荐,2018/2/6 22:34,45,剧情很紧凑能抓人心 也烧脑 最后的反转真的意想不到 超级好看 推荐！,
哼哼.floweray,看过,力荐,2017/3/22 21:09,41,罗生门的框架在前三分之二极具张力，顿时有一种消失的爱人，控方证人的预感。日式推理看得多了，其实恍恍惚惚能感觉到律师的嫌疑，但是最后的最后还是让人大呼爽快。,
Bless_U,看过,力荐,2018/1/13 15:05,134,环环相扣，编剧的逻辑实在是缜密，佩服佩服。主演的演技也是没话说，一场脑力与演技的盛宴，全程跟着电影节奏走，这才是好电影！,
战将波舰金,看过,很差,2017/3/24 4:04,51,其实闭上眼睛听满天的弦乐部分能获得差不多的效果,
柴斯卡,看过,力荐,2017/9/17 1:23,91,用院线片的标准来看真是很精彩了 《控方证人》灵魂附体 这是各个流派的导演都希望拍出来的电影 结尾都看哭了 中产焦虑蔓延全片 颇有代入 往深了说 这是一场 传统行业把互联网按到地上操死 的 大型隐喻实录,
张熊熊,看过,还行,2017/3/24 16:18,74,撒一个谎，就要用一百个谎来圆。最近口碑爆棚的惊悚片，其实无非是对真相的多种推测加上各种各样的强行反转。。老司机看到二十分钟就已经猜到了结局。。。配乐和色调不错~,
沈贵人的酒,看过,力荐,2017/11/4 0:00,73,电影出来就去看了，和室友一起去看的，一直忘记评分了，当时在电影院看的时候一直在猜到底谁是凶手，一直以为劳拉是凶手，后来发现不是，后来又觉得男主有双重人格，发现又错了，突然感觉自己没了智商，唯一猜对的就是那位律师不是真的律师，此片伏笔好多，值得一看,
陈哈,看过,推荐,2017/3/21 13:09,48,悬疑度其实并不很强。快感在别处。,
Adalepemi,看过,力荐,2021/6/14 0:26,83,就喜欢这种，玩儿观众，但不把观众当傻逼的电影。,
二丫主张,看过,推荐,2018/2/13 17:18,58,结局反转太精彩了，值得推荐。,
周眠,看过,力荐,2017/9/17 22:36,34,把智商情商调到适中，观影的你就变成了全程倒吸凉气的空调。,
风间隼,看过,还行,2017/4/5 14:09,26,节奏不错，确实挺抓人，但悬疑的设置并没有超出希胖的那些套路。关键是缺乏情感吧，没什么能打动人心的力量。,
一起吃地瓜,看过,推荐,2018/3/20 21:00,25,惊悚但好看，密室杀人，剧情很烧脑，情节转折铺垫的很好，观影体验也很棒。,
過期貓糧,看过,还行,2017/4/4 18:09,53,太聪明也是一种烦恼，看到一半就被自己剧透了。,
左胸上的吸盘,看过,还行,2017/8/5 23:43,38,很好的剧本，完全被牵着走了。开场男主为了避免偷情公开不惜代价的做法非常傻逼，但随剧情推进，你看到的都是罗生门式的场景复现，这种结构很容易让观者附加价值判断的指责落空，编导的真正意图是缓缓堆积剧力，最终呈现一个在法律框架内斗智斗勇斗执行力的局。风格上是通常的西班牙电影，没有短脚。,
ZWW,看过,力荐,2018/2/1 22:39,55,反转反转再反转，刺激又过瘾！,
shininglove,看过,推荐,2017/3/24 12:51,22,西语系小成本惊悚片往往胜在叙事方法和视觉效果，它尽可能地让强情节戏剧冲突渲染不再那么露骨。,
愛永,看过,力荐,2017/9/20 14:11,24,以為猜到了結局，其實並沒有。就像電影中的傲慢謊言，終被意想不到的力量所收拾。犯錯不可怕，可怕的是對錯誤毫無悔意，且執意錯到底，人性之惡莫過於此。,
朱老板,看过,推荐,2017/10/14 22:37,30,故事再三告诉我们，开车的时候不要扭头和乘客说话。。。,
Rilkelee,看过,较差,2017/5/12 19:22,21,烧脑，高智商；人性，神反转；一部豆瓣高分片就这么出来了哦耶！,
蜉蝣,看过,推荐,2017/9/14 20:48,14,其实不太喜欢这种为了反转而反转的剧本，而且对于稍有观影量的影迷来说都很好猜到结局。好在视听能跟上剧本的容量，完成得不错。沉车这段太容易让人想到《惊魂记》，剧作和节奏都是一模一样的。,
七七的蟹子壳,看过,力荐,2022/3/25 22:06,55,还是男人了解男人啊。我老公一上来就说，也许这个男的撒谎呢，明明是他的主意，却赖给他情人。另外，不要低估一对为儿女报仇的父母的心啊。,
荞麦,看过,推荐,2017/5/26 19:29,32,看到一半就猜到了，但荷尔蒙令我对父母心感同身受……完蛋了,
哪吒男,看过,还行,2017/9/2 11:22,35,豆瓣实在太爱反转了,
breathe,看过,较差,2018/1/12 20:11,70,后面反转很不错，导演的把控力还是很强的。,
赫恩曼尼,看过,力荐,2018/1/8 16:17,22,看得大气不敢喘，不得不说，太牛掰了。值得二刷。,
吃薯片的猫,看过,推荐,2018/1/26 0:15,47,很不错的电影，导演节奏掌握的不错，悬疑，一环扣一环，最后妈妈那里印象深刻。,
愛永,看过,力荐,2017/9/20 14:11,24,以為猜到了結局，其實並沒有。就像電影中的傲慢謊言，終被意想不到的力量所收拾。犯錯不可怕，可怕的是對錯誤毫無悔意，且執意錯到底，人性之惡莫過於此。,
张天翼,看过,推荐,2017/3/29 18:37,39,好看！种种情节转折的心理基础都铺垫得合情合理。缺点是剪辑手法有点老套。,
野象小姐,看过,推荐,2017/9/17 23:54,32,男主角的每件衣服质量都好好，超强特写也没起球。老夫妇那么聪明，儿子却开车不系安全带还发短信…哭,
我初中就一直在练习变成哪吒,看过,力荐,2017/3/27 1:12,33,对于想尽办法拿证据这件事儿作为一个打过官司的我来说太太太感同身受。还有大家难道相信那两夫妇儿子真的没有系安全带和发短信吗？？？我想大喊一声！发克！,
kiki204629,看过,推荐,2017/3/21 21:54,44,没有痛苦，就没有拯救，人啊，不要自以为是以为只有自己最聪明。人性的阴暗面可以让人淡定面对自己的污点，道貌岸然的伪装起来，这个反转又反转的罗生门，最后终于拼凑起所有的真相。剧情流畅，张力十足，用套路反套路，见招拆招的对决，所以，还是痛快点，撕破脸皮坦诚相见才不会让自己一步步作死。,
女神的秋裤,看过,力荐,2017/4/8 7:54,28,很棒的悬疑片，看着过瘾啊，再也不敢得罪会表演的人,
葵花卷,看过,推荐,2017/4/1 8:58,31,开始以为男主情人是gone girl里狠毒美貌女性角色设定，到后面才发现姜还是老的辣。正义会迟到，不会缺席。,
荔枝超人,看过,还行,2017/8/27 17:15,13,西班牙的【心迷宫】,
张咏轩Wayne®,看过,推荐,2017/3/20 21:49,25,套用杀人案和灭口案，按罗生门的方式，不断推翻和重塑两起案子的动机和关联，以达到接近真相的目的，虽然结局不难猜，但过程剑拔弩张，暗流涌动迷雾重重，用关键细节和大胆引设，把悬疑氛围烘托至最高点，西班牙近年来的惊悚片以细致严谨的排兵布阵来玩结构式解构，还不乏扣人心弦的精彩，实为出类拔萃,
东林君,看过,推荐,2017/9/16 0:25,28,现在的人已经忘了一个有文化有决心的修车工是多么可怕。,
草威,看过,推荐,2017/4/23 23:43,14,老两口长得太好了，一对璧人。,
账房先生,看过,推荐,2017/9/26 1:19,17,在《白夜追凶》里到处都是指纹取证、DNA和马路监控，感情西班牙是没有这项技术呀！,
盘子,看过,推荐,2017/9/23 23:58,14,这个打分就难了，打高了呢，不爽，因为真的没啥大意思；打低了呢呢，创作者太委屈，因为显然故事完成得还是很不错的；打三星就更没劲了。琢磨了一下，自己做不到，那就还是四星吧。,
李濛Lemon,看过,推荐,2017/9/24 22:09,19,悬疑类影片的导演真不好当，只要被观众猜到故事走向，片子质量仿佛就打了折扣似的。本片的结局并不难猜，但私以为最华丽的部分并不是主角设下的阴谋，也不是编剧设下的叙事圈套，而是在真真假假的讲述间不断反转重构的真相。对白很精彩，聪明人之间的战争，仅靠语言就能实现攻击和防守。,
木偶,看过,力荐,2017/3/26 15:06,22,全程高能，不断挖坑，不断反转，难得的经典。,
落苏,看过,推荐,2017/10/1 14:18,49,剧情非常连贯，精神高度集中，结局惊艳反转，配合大气的音乐真是一场头脑风暴，非常好看，演员最喜欢那对夫妇和女主，很动容了。有一些想不通的点，比如在酒店女主被杀，男主为啥要撒钱？？不知道是bug还是没有看懂。,
眠去,看过,推荐,2017/9/28 9:35,23,审判一气呵成,
汽车大师,看过,还行,2017/9/23 14:44,23,总感觉创作班底品味不是太好,
我初中就一直在练习变成哪吒,看过,力荐,2017/3/27 1:12,33,对于想尽办法拿证据这件事儿作为一个打过官司的我来说太太太感同身受。还有大家难道相信那两夫妇儿子真的没有系安全带和发短信吗？？？我想大喊一声！发克！,
